{
  "schema_version": 1,
  "skill": "camunda-feel",
  "discoverability": { "mode": "all_skills" },
  "positive": [
    {
      "id": "pos-gateway-condition",
      "prompt": "Write a condition that routes to the premium track when order total exceeds 1000 and the customer tier is gold.",
      "expected_load": ["camunda-feel"],
      "expected_dependencies": [],
      "must_not_load": []
    },
    {
      "id": "pos-input-mapping",
      "prompt": "I have a service task that needs an input mapping. Map customer.address.city to a variable called shippingCity.",
      "expected_load": ["camunda-feel"],
      "expected_dependencies": [],
      "must_not_load": []
    },
    {
      "id": "pos-timer-duration",
      "prompt": "Configure a timer that fires 2 business days after the task is created, skipping weekends.",
      "expected_load": ["camunda-feel"],
      "expected_dependencies": [],
      "must_not_load": []
    },
    {
      "id": "pos-list-projection",
      "prompt": "Given a list of orders, give me only the IDs of orders where status is 'pending' and amount > 500.",
      "expected_load": ["camunda-feel"],
      "expected_dependencies": [],
      "must_not_load": []
    },
    {
      "id": "pos-string-manipulation",
      "prompt": "How do I build a full name expression by concatenating firstName and lastName with a space?",
      "expected_load": ["camunda-feel"],
      "expected_dependencies": [],
      "must_not_load": []
    },
    {
      "id": "pos-dmn-input-entry",
      "prompt": "Write a DMN input entry expression that matches when riskScore is between 70 and 90 inclusive.",
      "expected_load": ["camunda-feel"],
      "expected_dependencies": [],
      "must_not_load": []
    },
    {
      "id": "pos-form-validation",
      "prompt": "Add a validation rule on a form field so the email address must contain an '@'.",
      "expected_load": ["camunda-feel"],
      "expected_dependencies": [],
      "must_not_load": []
    },
    {
      "id": "pos-debug-feel",
      "prompt": "This expression returns null and I don't understand why: `if amount > 1000 amount * 0.85 else amount`. Help me fix it.",
      "expected_load": ["camunda-feel"],
      "expected_dependencies": [],
      "must_not_load": []
    },
    {
      "id": "pos-discount-calc",
      "prompt": "Implement a tiered discount: 5% if order total >= 500, 10% if >= 1000, 15% if >= 2500. Return the discounted total.",
      "expected_load": ["camunda-feel"],
      "expected_dependencies": [],
      "must_not_load": []
    },
    {
      "id": "pos-context-access",
      "prompt": "I have a process variable called payload which is a context with a nested items list. Sum the price field across all items.",
      "expected_load": ["camunda-feel"],
      "expected_dependencies": [],
      "must_not_load": []
    }
  ],
  "negative": [
    {
      "id": "neg-juel-conversion",
      "prompt": "Convert this JUEL expression to Camunda 7 syntax: ${customer.tier == 'gold'}",
      "expected_load": [],
      "must_not_load": ["camunda-feel"]
    },
    {
      "id": "neg-bpmn-only",
      "prompt": "How do I model a parallel split followed by a parallel join in BPMN? No conditions needed, just the structure.",
      "expected_load": ["camunda-bpmn"],
      "must_not_load": ["camunda-feel"]
    },
    {
      "id": "neg-script-task-js",
      "prompt": "Write a JavaScript script task that doubles the value of myCount and stores it back.",
      "expected_load": [],
      "must_not_load": ["camunda-feel"]
    },
    {
      "id": "neg-deploy-only",
      "prompt": "How do I deploy invoice-approval.bpmn to my cluster?",
      "expected_load": ["camunda-process-mgmt"],
      "must_not_load": ["camunda-feel"]
    },
    {
      "id": "neg-cluster-setup",
      "prompt": "I want to start a local Camunda 8 cluster on my Mac. How do I do that?",
      "expected_load": ["camunda-c8ctl"],
      "must_not_load": ["camunda-feel"]
    },
    {
      "id": "neg-form-only",
      "prompt": "Create a Camunda Form with a text field for full name and a number field for age. No validation logic.",
      "expected_load": ["camunda-forms"],
      "must_not_load": ["camunda-feel"]
    },
    {
      "id": "neg-connector-config",
      "prompt": "I want to add a Slack connector to my process and post to #alerts. What template do I use?",
      "expected_load": ["camunda-connectors"],
      "must_not_load": ["camunda-feel"]
    },
    {
      "id": "neg-plain-english-business",
      "prompt": "Explain in plain English how a typical purchase-order approval workflow works in a procurement department.",
      "expected_load": [],
      "must_not_load": ["camunda-feel"]
    },
    {
      "id": "neg-incidents",
      "prompt": "I have stuck process instances with incidents on a service task. How do I find them and resolve the incidents?",
      "expected_load": ["camunda-process-mgmt"],
      "must_not_load": ["camunda-feel"]
    },
    {
      "id": "neg-generic-python",
      "prompt": "Write a Python function that returns True when a number is divisible by both 3 and 5.",
      "expected_load": [],
      "must_not_load": ["camunda-feel"]
    }
  ]
}
