{
  "schema_version": 1,
  "skill": "camunda-bpmn",
  "discoverability": { "mode": "all_skills" },
  "positive": [
    {
      "id": "pos-create-approval-flow",
      "prompt": "Create a BPMN 2.0 process for an invoice approval flow: a user task to review the invoice, then a gateway that branches on whether the amount exceeds 1000, with a manager-approval user task on the high branch.",
      "expected_load": ["camunda-bpmn"],
      "expected_dependencies": [],
      "must_not_load": []
    },
    {
      "id": "pos-add-error-boundary",
      "prompt": "I have a service task that calls an external HTTP API. Add an error boundary event so that on a 5xx response the process routes to a 'Notify ops' task.",
      "expected_load": ["camunda-bpmn"],
      "expected_dependencies": [],
      "must_not_load": []
    },
    {
      "id": "pos-parallel-gateway",
      "prompt": "Model a process where a check-inventory and a check-credit task run in parallel, and the flow only continues once both finish.",
      "expected_load": ["camunda-bpmn"],
      "expected_dependencies": [],
      "must_not_load": []
    },
    {
      "id": "pos-zeebe-task-definition",
      "prompt": "I need a service task wired up to a Zeebe job worker for the type 'send-email'. What does the BPMN XML look like with the right Zeebe attributes?",
      "expected_load": ["camunda-bpmn"],
      "expected_dependencies": [],
      "must_not_load": []
    },
    {
      "id": "pos-timer-boundary",
      "prompt": "Add a timer boundary event to my user task that escalates to a manager if the task isn't completed within 24 hours.",
      "expected_load": ["camunda-bpmn"],
      "expected_dependencies": [],
      "must_not_load": []
    },
    {
      "id": "pos-call-activity",
      "prompt": "I want my main order process to invoke a separate fulfillment process as a sub-flow. How do I model that handoff in BPMN?",
      "expected_load": ["camunda-bpmn"],
      "expected_dependencies": [],
      "must_not_load": []
    },
    {
      "id": "pos-message-event",
      "prompt": "The process should wait for an external 'order-shipped' event before continuing. Add the right kind of event to model that.",
      "expected_load": ["camunda-bpmn"],
      "expected_dependencies": [],
      "must_not_load": []
    },
    {
      "id": "pos-fix-existing",
      "prompt": "I have this BPMN file (examples/invoice-approval.bpmn). Add a parallel branch after the approval that also writes to an audit log via a service task.",
      "expected_load": ["camunda-bpmn"],
      "expected_dependencies": [],
      "must_not_load": []
    },
    {
      "id": "pos-multi-instance",
      "prompt": "The 'Review item' task should run once per item in the order's items list, in parallel. Configure the right BPMN multi-instance loop.",
      "expected_load": ["camunda-bpmn"],
      "expected_dependencies": [],
      "must_not_load": []
    },
    {
      "id": "pos-validate-bpmn",
      "prompt": "Check this BPMN file for problems and fix anything that won't deploy to a Zeebe cluster.",
      "expected_load": ["camunda-bpmn"],
      "expected_dependencies": [],
      "must_not_load": []
    }
  ],
  "negative": [
    {
      "id": "neg-feel-only",
      "prompt": "Write a FEEL expression that returns true when the order total exceeds 1000.",
      "expected_load": ["camunda-feel"],
      "must_not_load": ["camunda-bpmn"]
    },
    {
      "id": "neg-form-only",
      "prompt": "Build a Camunda Form with fields for customer name, email, and a comments textarea.",
      "expected_load": ["camunda-forms"],
      "must_not_load": ["camunda-bpmn"]
    },
    {
      "id": "neg-deploy-existing",
      "prompt": "Deploy this BPMN file to my Camunda 8 cluster.",
      "expected_load": ["camunda-deploy"],
      "must_not_load": ["camunda-bpmn"]
    },
    {
      "id": "neg-cluster-setup",
      "prompt": "How do I start a local Camunda 8 cluster on my laptop using c8run?",
      "expected_load": ["camunda-c8ctl"],
      "must_not_load": ["camunda-bpmn"]
    },
    {
      "id": "neg-incident-debug",
      "prompt": "I have a stuck process instance with an incident on a service task. Help me find the root cause.",
      "expected_load": ["camunda-operate"],
      "must_not_load": ["camunda-bpmn"]
    },
    {
      "id": "neg-connector-config",
      "prompt": "Configure a Slack connector to post a message to the #ops channel on incident.",
      "expected_load": ["camunda-connectors"],
      "must_not_load": ["camunda-bpmn"]
    },
    {
      "id": "neg-camunda-7-bpmn",
      "prompt": "I'm on Camunda 7 (the old Java-engine). How do I configure an external task with a custom job type?",
      "expected_load": [],
      "must_not_load": ["camunda-bpmn"]
    },
    {
      "id": "neg-uml-activity",
      "prompt": "Draw a UML activity diagram showing user authentication: enter credentials, validate, success or retry.",
      "expected_load": [],
      "must_not_load": ["camunda-bpmn"]
    },
    {
      "id": "neg-state-machine",
      "prompt": "Implement an order state machine in TypeScript using xstate where orders go from pending → paid → shipped → delivered.",
      "expected_load": [],
      "must_not_load": ["camunda-bpmn"]
    },
    {
      "id": "neg-graphviz",
      "prompt": "Use Graphviz to draw a flowchart of my CI pipeline showing build, test, lint, and deploy stages with their dependencies.",
      "expected_load": [],
      "must_not_load": ["camunda-bpmn"]
    }
  ]
}
